Title,URL,Date,Content
"""Mẹ bỉm sữa"" nổi tiếng với câu chuyện vừa sinh 5 con vừa tốt ...",https://www.doisongphapluat.com/me-bim-sua-noi-tieng-voi-cau-chuyen-vua-sinh-5-con-vua-tot-nghiep-thac-si-harvard-a327949.html,2020-06-21," Bà mẹ Nhật sinh 5 con trong 8 năm, tốt nghiệp thạc sĩ ở Harvard. Cô cũng cho xuất bản cuốn sách kể về hành trình của mình. ""Mẹ bỉm sữa"" Nhật sinh 5 con trong 8 năm, tốt nghiệp thạc sĩ ở Harvard. Cô cũng cho xuất bản cuốn sách kể về hành trình của mình. Honami Yoshida sinh năm 1974 trong một gia đình có 3 chị em, cha mẹ đều làm bác sĩ. Cô từng sống ở Mỹ 2 năm khi cha mẹ làm việc tại Cao đẳng Y tế Texas. Năm 30 tuổi, khi đang làm bác sĩ sản khoa tại Đại học Nagoya, Nhật Bản, Yoshida kết hôn với chồng là chuyên gia nghiên cứu về SARS, AIDS và cúm gia cầm. Năm 2004, trong khi tập huấn tại một bệnh viện ở Frankfurt, Đức, Yoshida sinh con đầu lòng. Hai năm sau, cô trở về Nhật Bản làm việc tại một bệnh viện phụ sản ở Tokyo. Em bé thứ 2 cũng sớm chào đời. Khi phải chăm con, cô lo sợ mình khó thăng tiến trong sự nghiệp. Bởi vậy, Yoshida quyết định đi du học tại Harvard, Mỹ. 21h mỗi tối, khi các con đi ngủ, cô ngủ cùng và thức dậy vào 3h sáng. Như vậy, cô sẽ có khoảng 3 tiếng hoàn toàn riêng tư để học. Thời gian này cũng là lúc tôi tập trung tốt nhất để thu nạp kiến thức. Yoshida còn tranh thủ học thêm 3 tiếng trong lúc đi bộ, đợi tàu và thời gian ngồi trên tàu đến cơ quan. Trong thời gian chuẩn bị hồ sơ du học Mỹ, Yoshida mang thai con thứ 3. Cô quyết định vừa tập trung cho việc học, vừa chuẩn bị mọi thứ để chào đón thiên thần nhỏ. Sau thời gian kiên trì, năm 2008, Yoshida được nhận vào trường Y tế Công cộng Harvard. Chồng cô cũng tới Boston và theo học đại học ở đây. Hai vợ chồng đã có đứa con thứ 4 trong thời gian ở Mỹ. Thời gian đầu ở nước ngoài không dễ dàng, 2 vợ chồng phải vừa học, vừa chăm sóc các con, đứa lớn nhất mới 3 tuổi. Yoshida rơi vào khủng hoảng, cô gần như trầm cảm và sụt mất 4,5 kg trong 3 tháng đầu. Bà mẹ trẻ gặp khó khăn không nhỏ về kinh tế. Sau đó, Yoshida bắt đầu bình tâm để tìm hướng giải quyết từng vấn đề. Đầu tiên, cô đi xin các khoản trợ cấp thu nhập, chăm sóc y tế. Cô cũng xin học bổng từ nhiều tổ chức khác nhau. Dần dần, mọi thứ đi vào quỹ đạo. Sau 2 năm học, Yoshida đã lấy được bẳng thạc sĩ về sức khỏe cộng đồng. Cô về nước và làm giám đốc nghiên cứu của Phòng nghiên cứu sức khỏe nghề nghiệp, Viện khoa học y tế quốc gia Nhật Bản. Hai năm sau, vợ chồng cô có con thứ 5. Trong vòng 8 năm, từ 2004 đến 2012, bà mẹ người Nhật đã vừa chuẩn bị thi cử, tốt nghiệp thạc sĩ ở Harvard và sinh được 5 người con.  Ít lâu sau, Yoshida xuất bản cuốn tự truyện ""Yoshida Doctor Harvard School"".  Châm ngôn của Yoshida là: “Không phải vì một điều quá khó khiến ta không dám làm mà bởi ta không dám làm nên nó mới trở thành thứ khó khăn”.Việt Hương (T/h)Link nguồn: https://www.nguoiduatin.vn/dspl/me-bim-sua-noi-tieng-voi-cau-chuyen-vua-sinh-5-con-vua-tot-nghiep-thac-si-harvard-a327949.html "
"Sau Tết, rau xanh, hải sản ""đội giá"" vẫn cháy hàng",https://www.doisongphapluat.com/sau-tet-rau-xanh-hai-san-doi-gia-van-chay-hang-a262321.html,2019-02-09," Vào những ngày đầu năm mới, giá cả các loại rau xanh nói riêng và thực phẩm nói chung đã có diễn biến tăng nhẹ, từ 20-50%. Vào những ngày đầu năm mới, giá cả các loại rau xanh nói riêng và thực phẩm nói chung đã có diễn biến tăng từ 20-50%. Sau Tết, ở thành phố Vinh rau xanh tăng giá, có nhiều loại, giá gấp đôi so với ngày thường. Ảnh: Báo Nghệ AnHôm nay (9/2), ghi nhận tại các chợ truyền thống, giá mặt hàng thực phẩm tươi sống cao hơn so với ngày thường từ 20.000 - 50.000 đồng/kg. Cụ thể, thịt gà giá 75.000 - 150.000 đồng/kg, thịt bò 200.000 - 350.000 đồng/kg, thịt lợn nạc giá từ 90.000 - 150.000 đồng/kg.Mặt hàng rau xanh cũng tăng giá gấp 2 lần so với ngày thường, cụ thể cà chua từ 10.000 - 15.000 đồng/kg tăng lên 30.000 đồng/kg; nấm rơm từ 10.000 đồng/100 gr lên 20.000 đồng/100gr; rau thơm các loại có giá 60.000 - 70.000 đồng/kg, khoai tây có giá 90.000 -120.00 đồng/kg…Không riêng gì mặt hàng rau xanh, do ăn nhiều thịt trong mấy ngày Tết, nên hôm nay, các mặt hàng hải sản tươi sống được người dân chọn mua nhiều. Các loại sò huyết, nghêu, ốc hương, tôm càng xanh, tôm sú, hải sâm cá nục, cá thu, cua biển... đều tăng giá gấp 3 lần nhưng vẫn trong tình trạng cháy hàng.Đặc biệt với quan niệm ăn lươn đầu năm để “trơn bọt lọt lành”, rất nhiều người dân mua lươn về chế biến các món ăn nên giá cả cao gấp rưỡi, gấp đôi so với ngày thường, dao động từ 270.000 - 300.000 đồng/kg (bình thường chỉ khoảng 150.000 - 170.000 đồng/kg).Chị Nguyễn Thị Lam, người dân phường Hồng Sơn (TP.Vinh) cho biết: “Xác định ra năm sẽ có chợ sớm nên trong Tết tôi không mua tích trữ nhiều thực phẩm. Vả lại thời tiết năm nay nắng nóng, đồ ăn không để được lâu, nên từ mồng 3 Tết, tôi đã ra chợ mua các loại rau, thịt tươi về phục vụ bữa ăn cho cả gia đình. Giá cả các mặt hàng này tăng cao so với ngày thường”.Theo lý giải của các tiểu thương tại chợ truyền thống, ngày mùng 5 Tết, người dân vẫn còn đang trong kì nghỉ Tết, các đầu mối hải sản chưa cung cấp hàng. Những mặt hàng hải sản hiện bán là được các tiểu thương mua về dự trữ trong kho lạnh từ trước Tết. Do phải tốn thêm phí thuê lưu kho lạnh nên giá cao tăng, khi các thương lái cung cấp hàng trở lại thì giá  sẽ trở về như cũ.Bà Trần Thị Phương Lan, Phó Giám đốc Sở Công Thương Hà Nội cho biết, để đảm bảo giá cả không tăng đột biến, Sở đã ban hành Kế hoạch phục vụ Tết Dương lịch và Tết Nguyên đán Kỷ Hợi 2019. Có hơn 20 doanh nghiệp đăng ký tham gia chương trình dự trữ 8.680 tỷ đồng, tổ chức đưa hàng bình ổn đến 10.688 điểm bán hàng (tăng 3.865 điểm) và 3 tổ chức tín dụng tham gia với tổng hạn mức đăng ký trên 2.700 tỷ đồng, lãi suất ưu đãi.Bên cạnh đó, còn có 200 điểm bán hàng của các doanh nghiệp đăng ký với Sở mở cửa bán hàng phục vụ nhân dân từ ngày mùng 1 đến ngày mùng 3 Tết; trong đó 125 điểm bán hàng mở cửa từ ngày mùng 1 Tết, thêm 75 điểm bán đăng ký mở cửa từ ngày mùng 2, mùng 3 Tết. Ngày mùng 4 Tết thì hầu hết các cửa hàng, Trung tâm thương mại, siêu thị trên địa bàn Hà Nội đã mở cửa trở lại.NGUYỄN QUỲNH (T/h)Link nguồn: https://www.nguoiduatin.vn/dspl/sau-tet-rau-xanh-hai-san-doi-gia-van-chay-hang-a262321.html "
"Bài viết về "" Đại Dịch Cúm """,https://www.doisongphapluat.com/dai-dich-cum.html,,"         Cảnh báo nguy cơ cúm A/H7N9 xâm nhập từ Trung Quốc vào Việt Nam     Thứ 4, 01/02/2017 | 02:00  Cục Y tế dự phòng (Bộ Y tế) nhận định, nguy cơ dịch cúm A/H7N9 xâm nhập từ Trung Quốc vào nước ta là rất lớn.  "
"Mẹ ốm sốt hôm trước, hôm sau con gái 18 tháng tuổi được chẩn ...",https://www.doisongphapluat.com/me-om-sot-hom-truoc-hom-sau-con-gai-18-thang-tuoi-duoc-chan-doan-nhiem-cum-ah1n1-a219396.html,2018-02-09," Thời tiết thay đổi thất thường, nắng mưa đột ngột là lý do khiến trẻ mắc bệnh cúm mùa gia tăng nhanh chóng. Các gia đình có con nhỏ cần đặc biệt lưu tâm. Thời tiết thay đổi thất thường, nắng mưa đột ngột là lý do khiến trẻ mắc bệnh cúm mùa gia tăng nhanh chóng. Các gia đình có con nhỏ cần đặc biệt lưu tâm.Trong những ngày qua, thời tiết thay đổi thất thường, nắng mưa đột ngột là lý do khiến trẻ mắc bệnh cúm mùa gia tăng nhanh chóng. Thống kê trong vòng 2 tuần cuối tháng 1/2018 tại Bệnh viện Nhi TW cho thấy, đã có hơn 300 bệnh nhi được chẩn đoán mắc bệnh cúm mùa, trong đó hơn 100 trường hợp phải nhập viện điều trị, có bệnh nhi bị biến chứng viêm phổi, viêm phế quản…Tại Khoa nhi Bệnh viện Bạch Mai hàng ngày cũng có hàng trăm bệnh nhi đến khám do có các triệu trứng nghi cúm.Có con bị nhiễm cúm A, nhiều mẹ trẻ lo lắng. Chia sẻ về vấn đề này, chị Thu Hà vẫn chưa hết lo sợ khi bác sĩ kết luận con gái chị bị nhiễm cúm A, trong khi trước đó chị đưa bé đi khám ở phòng khám tư nhân, nhân viên y tế lại chẩn đoán bé bị viêm phế quản.Chị Hà (33 tuổi) cho biết, ngày 2/2, chị bị sốt cao, rét run, cơ bắp mỏi nhừ và đau họng. Cho rằng mình bị viêm họng, chị uống kháng sinh khoảng vài ngày thì đỡ. Con gái chị Thu Hà đã dần ổn định.Con gái chị Hà được 18 tháng tuổi. Bé sốt sau mẹ một ngày, khoảng 39-41 độ C. Bà mẹ Hà Nội dùng nhiều cách hạ sốt cho con như chườm nóng, cởi bớt quần áo, đặt thuốc vào hậu môn nhưng không đỡ. Chị đưa con tới phòng khám tư ở khu vực Linh Đàm thì được chẩn đoán bé bị viêm phế quản, chỉ định điều trị kháng sinh. Sau một ngày uống thuốc, con gái chị Thu Hà vẫn sốt cao, li bì, đôi lúc có biểu hiện giật nhẹ.Xâu chuỗi các triệu chứng của bé, chị Hà chưa yên tâm với chẩn đoán con bị viêm phế quản. Tìm hiểu một số thông tin về cúm A, chị phát hiện mọi biểu hiện của bé đều trùng khớp với triệu chứng bệnh. Sáng hôm sau, chị Hà cho con xét nghiệm máu và 15h cùng ngày, chị nhận được kết quả bé dương tính với cúm A. Con gái chị Hà được làm thêm xét nghiệm PCR để khẳng định nhiễm H1N1. Phiếu xét nghiệm của bé.Chị Thu Hà liên hệ với nhiều bệnh viện tư nhân nhưng đều bị từ chối. Chị quyết định đưa con tới điều trị tại Bệnh viện Nhiệt đới gần nhà. Lúc này, khoa Nhi của Bệnh viện Nhiệt đới đang quá tải. Một giường có tới 2-3 bệnh nhi. Con gái chị Hà sau khi chụp X-quang được thông báo virus đã chớm vào phổi. Bé được uống thuốc tamiflu. Theo chị Hà, loại thuốc này dành riêng cho chủng cúm A, có tác dụng giảm và kết thúc nhanh cơn sốt.Chị Thu Hà cho biết cúm A rất nguy hiểm, khiến bệnh nhi sốt cao và không thể hạ sốt. Cúm A biến chứng thẳng vào phổi. Nhiều bệnh nhi sốt quá cao khiến ven lặn. Bác sĩ phải lấy ven ở tay, cổ, đầu, chân khiến bé đau đớn. Cúm A là dịch do virus gây ra, dễ dàng và nhanh chóng lây lan trong cộng đồng.Con gái chị Thu Hà sau hai ngày nhập viện đã tỉnh táo hơn, bớt sốt nhưng ho nhiều. Hiện bé được điều trị kháng sinh chờ hồi phục.Không chỉ riêng chị Thu Hà, mà còn có rất nhiều bà mẹ khác phải bỏ công việc, dừng việc sắm Tết, chuẩn bị Tết chỉ để ở lại viện chăm sóc cho con mắc bệnh cúm A.Vừa dỗ con khóc ngằn ngặt vì khó chịu trong phòng điều trị nội trú Khoa Truyền nhiễm (Bệnh viện Nhi Trung ương), chị H.T.T (30 tuổi, mẹ của bé H.A, 4 tuổi ở Hà Nội) cho biết, ban đầu bé H.A chỉ sốt, gia đình vẫn cho rằng bé bị sốt viêm họng thông thường, nhưng tình trạng bé nặng hơn khi ho nhiều, mũi chảy máu, có lúc còn xảy ra tình trạng lơ mơ, co giật. Ngay lập tức, gia đình chị T đưa con đến viện, các bác sĩ tiến hành lấy máu xét nghiệm và phát hiện bé bị cúm A. “Ở lớp con có tới mấy bạn bị cúm, chắc con bị lây từ đó”, chị T chia sẻ.Bé H.A là một trong số gần 30 trẻ đang điều trị nội trú tại Khoa vì mắc cúm. Bệnh viện Nhi Trung ương cho biết, chỉ trong 2 tuần qua, khi thời tiết thay đổi từ rét đậm 9-10 độ C, rồi nhiệt độ nhích dần lên nhưng lúc lại ẩm thấp, lúc hanh khô, đã khiến hàng trăm trẻ đến khám vì các triệu chứng cúm. Trong đó, các bác sĩ phát hiện hơn 300 bệnh nhi mắc cúm, gần 100 cháu đã phải nhập viện điều trị.Không chỉ tại Bệnh viện Nhi Trung ương, tình trạng gia tăng các bệnh nhi mắc cúm đến khám và nhập viện điều trị cũng xảy ra ở nhiều bệnh viện trên địa bàn Hà Nội. Chị Hồng Nguyên (ở Mễ Trì, Nam Từ Liêm, Hà Nội) cho biết, khởi đầu, con gái 3 tuổi của chị sốt cao 39-40 độ C liên tục trong 2 ngày, viêm họng, ra nước mũi nhiều. Nghe người nhà “mách” Hà Nội đang mùa cúm, chị đưa con đi khám, test cúm ở Bệnh viện Đa khoa Xanh Pôn thì cho kết quả con chị bị cúm A, kèm viêm phế quản. “Chỉ trong buổi tối con sốt cao phải đi viện, tôi thấy có tới 8/10 tờ phiếu trả kết quả xét nghiệm đều ghi bệnh nhân mắc cúm A, B”, chị Nguyên nói.Trước dịch cúm mùa này, PGS.TS y học Nguyễn Tiến Dũng, Nguyên trưởng khoa nhi, Bệnh viện Bạch Mai đã chia sẻ, ""Không phải cứ mắc cúm là cho con vào viện"". Bác sĩ khuyến cáo, chỉ nên cho trẻ nhập viện trong những trường hợp cúm biến chứng như viêm phổi nặng, suy hô hấp: “Gần đây rất nhiều người hỏi tôi là con nhà em xét nghiệm thấy cúm A rồi thế là sợ phát khiếp và cho vào viện, đấy là sai. Cúm phải xác định là biến chứng gì chứ cúm thường mà cho vào viện là không nên”.Bác sĩ cũng cho biết diễn biến của bệnh cúm thường là tự khỏi, bằng cách chăm sóc tại nhà, chủ yếu là dùng thuốc hạ sốt (chỉ dùng thuốc paracetamol). Thuốc Oseltamivir không phải là thuốc bắt buộc phải có để điều trị trong những trường hợp cúm mùa thông thường và chỉ sử dụng trong một số trường hợp cúm nặng. Nếu trẻ được chăm sóc tốt, không có bội nhiễm thì tuyệt đối không tự ý dùng kháng sinh cho trẻ, tránh tình trạng kháng thuốc kháng sinh lan tràn. Các phụ huynh cũng không cần quá lo lắng, nên chú ý cho con nghỉ ngơi, tránh ra ngoài nhiều để tránh những biến chứng.Dấu hiệu nhận biết của bệnh- Có biểu hiện sốt cao đột ngột (trên 38 độ C), ho, đau họng, sổ mũi, đau đầu, đau cơ, mệt mỏi. Một số trường hợp nặng có thể bị suy hô hấp và dẫn đến tử vong.- Bệnh cúm H1N1 có triệu chứng giống với cúm thông thường, chỉ có thể chẩn đoán xác định bằng lấy dịch mũi họng để xét nghiệm.Mỹ An (T/h)Link nguồn: https://www.nguoiduatin.vn/dspl/me-om-sot-hom-truoc-hom-sau-con-gai-18-thang-tuoi-duoc-chan-doan-nhiem-cum-ah1n1-a219396.html "
"Một học sinh tiểu học ở Thái Bình tử vong vì cúm, gần 500 học sinh ...",https://www.doisongphapluat.com/mot-hoc-sinh-tieu-hoc-o-thai-binh-tu-vong-vi-cum-gan-500-hoc-sinh-nghi-hoc-vi-so-lay-a268725.html,2019-03-29," Sự việc một học sinh của trường Tiểu học thị trấn Vũ Thư, Thái Bình tử vong do cúm khiến các phụ huynh lo lắng nên đã cho gần 500 học sinh dừng đến trường vì sợ lây. Sự việc một học sinh của trường Tiểu học thị trấn Vũ Thư, Thái Bình tử vong do cúm khiến các phụ huynh lo lắng nên đã cho gần 500 học sinh dừng đến trường vì sợ lây. Lo ngại dịch cúm B, nhiều phụ huynh có con học tại Trường tiểu học thị trấn Vũ Thư, tỉnh Thái Bình không cho con đến trường nhiều ngày nay. Ảnh: Tuổi TrẻTheo Vietnamnet, thông tin từ Sở Y Tế Thái Bình cho biết: Trên địa bàn đã xảy ra một trường hợp tử vong có liên quan đến cúm mùa (cúm B).Cụ thể ngày 23/3 vừa qua có một em học sinh lớp 5A3, trường Tiểu học Thị trấn Vũ Thư, huyện Vũ Thư, Thái Bình đã bị ốm. Gia đình đã chuyển tới Bệnh viện nhi tỉnh Thái Bình để điều trị. Tuy nhiên cháu bé có biểu hiện sốt cao, đau đầu, mệt mỏi, nôn, nói nhảm.Sau hai ngày điều trị, bệnh nhân đã tử vong. Cơ quan y tế đã xác định em học sinh trên bị tử vong do suy đa tạng, viêm não cấp kèm theo có cúm B hay còn gọi là cúm mùa. Đây là trường hợp song trùng viêm não cấp cùng với cúm B.  Đồng thời Trung tâm y tế huyện Vũ Thư phối hợp cùng Trung tâm kiểm soát bệnh tật tỉnh Thái Bình thực hiện giám sát dịch tễ học, lấy mẫu xét nghiệm và thực hiện các biện pháp chủ động phòng chống dịch.Sự việc khiến nhiều phụ huynh, học sinh của Trường tiểu học thị trấn Vũ Thư hoang mang, lo lắng vì cho rằng việc ốm sốt có thể lây lan.Thông tin trên tờ Tuổi Trẻ cho biết, ngày 25/3, trường tiểu học thị trấn Vũ Thư có 57 học sinh nghỉ học, ngày 26/3 có 126 học sinh nghỉ học và cao điểm nhất là ngày 27/3 có tới 446 học sinh nghỉ học.Một lãnh đạo Phòng Giáo dục - đào tạo huyện Vũ Thư cho biết trong ngày 28/3 vẫn còn 186 học sinh Trường tiểu học thị trấn Vũ Thư nghỉ học.Bà Lại Thị Thỏa, hiệu trưởng Trường tiểu học thị trấn Vũ Thư, cho biết trường hiện có 23 lớp học với tổng số hơn 1.000 học sinh. Ngày 25/3, khi nhận thấy số lượng học sinh nghỉ học tăng bất thường, đặc biệt là tại lớp 1A3 có 20 học sinh nghỉ học, lớp 5A3 có 10 học sinh nghỉ học, nhà trường đã báo cáo sự việc với Trạm y tế, Trung tâm Y tế huyện Vũ Thư, Phòng Giáo dục -đào tạo huyện Vũ Thư.Nguyên nhân là do phụ huynh học sinh lo lắng trước thông tin dịch cúm B nên đã không đưa con em mình đến trường.Thu Hằng (T/h)Link nguồn: https://www.nguoiduatin.vn/dspl/mot-hoc-sinh-tieu-hoc-o-thai-binh-tu-vong-vi-cum-gan-500-hoc-sinh-nghi-hoc-vi-so-lay-a268725.html "
Kinh hãi dòi lúc nhúc ở lò giết mổ gà chui ngay tại chợ,https://www.doisongphapluat.com/doi-luc-nhuc-o-lo-giet-mo-ga-chui-ngay-tai-cho-a72251.html,2014-12-03," Ghi nhận hiện trường cho thấy việc giết mổ được tổ chức ngay trên… bãi rác lâu ngày bốc mùi hôi thối, dòi bò lổm ngổm, ruồi nhặng khắp nơi. Ghi nhận hiện trường cho thấy việc giết mổ được tổ chức ngay trên… bãi rác lâu ngày bốc mùi hôi thối, dòi bò lổm ngổm, ruồi nhặng khắp nơi.Sáng 3/12, Đoàn Liên ngành phòng chống dịch cúm gia súc gia cầm huyện Bình Chánh TP.HCM kiểm tra tại chợ Đông Thành (xã Bình Chánh), phát hiện điểm giết mổ gia cầm trái phép.Cũng như nhiều lần kiểm tra trước, khi phát hiện lực lượng chức năng, đối tượng nhanh chóng tẩu táng tang vật. Tuy nhiên, trong lúc vội vã, chủ hàng còn bỏ lại 45 con gà lông, một con gà chết, dao cắt tiết còn dính máu, nhiều tô “huyết nếp” và một giỏ đựng huyết gà tươi vô cùng dơ bẩn để ngay dưới đất.Huyết gà đựng trong giỏ bẩn, trên bãi rác.Thời gian qua, nhiều bà nội trợ vẫn tin rằng mua gà sống rồi nhờ giết mổ ngay thịt sẽ ngon hơn gà giết mổ công nghiệp, nên các điểm giết mổ gia cầm lậu vẫn tồn tại.Cùng ngày, Đoàn kiểm tra còn xử lý một điểm sơ chế phụ phẩm không phép ngay cạnh nhiều ngôi mộ ở địa chỉ B20/5C ấp 2, xã Bình Chánh của bà Phan Thị Vĩnh Thi, tạm giữ 444 kg phổi heo không có giấy chứng nhận kiểm dịch và 160 kg thịt heo bốc mùi hôi thối đang vận chuyển bằng xe máy biển số 62H1- 04736 của ông Lê Công Giang (Long An). Toàn bộ số tang vật trên được tổ chức tiêu hủy theo quy định.Link nguồn: https://www.nguoiduatin.vn/dspl/doi-luc-nhuc-o-lo-giet-mo-ga-chui-ngay-tai-cho-a72251.html "
