Title,URL,Date,Content
Ghi nhận thêm 3 ca nhiễm cúm A/H1N1 tại Khánh Hòa,https://www.doisongphapluat.com/ghi-nhan-them-3-ca-nhiem-cum-ah1n1-tai-khanh-hoa-a21727.html,2014-02-16," Thông tin từ Bệnh viện Đa khoa Khánh Hòa cho biết, bệnh viện đang điều trị cho 3 bệnh nhân đều là người trong tỉnh bị nhiễm cúm A/H1N1. Thông t?n từ bác sĩ Nguyễn Đông, Trưởng Khoa Truyền nh?ễm, Bệnh v?ện Đa khoa Khánh Hòa cho b?ết, bệnh v?ện đang đ?ều trị cho 3 bệnh nhân đều là ngườ? trong tỉnh bị nh?ễm cúm A/H1N1.Đó là các bệnh nhân: Bo Bo Thị Xuất (18 tuổ?) trú tạ? xã Sơn Bình, huyện Khánh Sơn; Nguyễn Thị Đ?ệp (45 tuổ?) và Lê Ngọc Trà My (17 tháng tuổ?) cùng trú tạ? thành phố Nha Trang (Khánh Hòa). Kết quả mẫu bệnh phẩm của 3 bệnh nhân này do V?ện Pasteur Nha Trang thực h?ện đều dương tính vớ? cúm A/H1N1. Ba bệnh nhân trên đều nhập v?ện ngày 11/2 vừa qua vớ? các tr?ệu chứng sốt, ho. Trong đó, bệnh nhân Bo Bo Thị Xuất đang phả? đ?ều trị đặc b?ệt tạ? phòng cách ly của Khoa Truyền nh?ễm, t?ên lượng bệnh nặng. Ha? bệnh nhân còn lạ? t?ên lượng bệnh t?ến tr?ển tốt.Đ?ều trị cúm A/H1N1 tạ? Bệnh v?ện Đa khoa Khánh Hòa. Ảnh: B.NTrước đó như đã thông t?n, tỉnh Khánh Hòa đã có 1 ngườ? tử vong do nh?ễm cúm A/H1N1. Đó là là bệnh nhân Huỳnh Thanh Tuấn (30 tuổ?) thường trú tạ? xã Vĩnh Thạnh (TP. Nha Trang), tử vong lúc 17h10 ngày 13/2.C.P (theo GLO)Link nguồn: https://www.nguoiduatin.vn/dspl/ghi-nhan-them-3-ca-nhiem-cum-ah1n1-tai-khanh-hoa-a21727.html "
Trung Quốc: Thiệt hại trên 280 nghìn tỷ VND vì dịch H7N9,https://www.doisongphapluat.com/trung-quoc-thiet-hai-tren-280-nghin-ty-vnd-vi-dich-h7n9-a21143.html,2014-02-12," (ĐSPL) – Ngành công nghiệp gia cầm của Trung Quốc đã thiệt hại trên 280 nghìn tỷ đồng do người dân lo sợ về ảnh hưởng của dịch cúm H7N9. (ĐSPL) – Ngành chăn nuô? g?a cầm Trung Quốc đã th?ệt hạ? trên 280 nghìn tỷ đồng do ngườ? dân lo sợ về ảnh hưởng của dịch cúm H7N9.Các nhà chức trách của tỉnh Quảng Đông và tỉnh Quảng Tây, m?ền nam Trung Quốc, cũng như các công ty và h?ệp hộ? công ngh?ệp quốc g?a kêu gọ? chính phủ k?ềm chế v?ệc truyền thông đưa t?n về dịch cúm g?a cầm H7N9 bùng phát đang ngày càng lan rộng và các ca mớ? mắc bệnh, hãng X?nhua cho b?ết.Quảng Đông cũng ngừng v?ệc cung cấp những thông t?n mớ? nhất về dịch cúm H7N9 cho báo chí và bỏ thông t?n về thờ? g?an bệnh nhân t?ếp xúc vớ? các loạ? g?a cầm khỏ? hồ sơ lưu trữ.t?n-tuc/the-g?o?/trung-quoc-t?em-thuoc-chuot-vao-sua-chua-19-tre-b?-ngo-doc-a14636.html"">Trung Quốc: Th?ệt hạ? trên 280 nghìn tỷ VND vì dịch H7N9Kêu gọ? này được đưa ra đố? lập vớ? ý k?ến của ngườ? dân, nhất là tạ? khu vực trung tâm của cuộc bùng nổ dịch SARS năm 2003, kh? tổng số ngườ? chết do căn bệnh lây truyền này kh?ến mọ? ngườ? nhận ra rằng nỗ lực che g?ấu dịch bệnh vì mục đích duy trì trật tự công cộng là hoàn toàn phản tác dụng.Xu L?fan, một nhà bình luận của T?mes, nhận định sức khỏe của ngườ? dân và v?ệc ngăn chặn dịch bệnh không thể bị tác động bở? lợ? ích của nhà sản xuất. Chính phủ có trách nh?ệm bồ? thường cho những ngườ? dân nuô? g?a cầm nhưng không nên che g?ấu bất kỳ trường hợp nào mắc bệnh.Ca mắc H7N9 đầu t?ên xuất h?ện ở Trung Quốc vào tháng 3 năm ngoá? và 46 bệnh nhân đã tử vong trong số 148 trường hợp bị phát h?ện nh?ễm bệnh. Nguyên nhân lây lan căn bệnh vẫn chưa được xác nhận. Một số chuyên g?a cho rằng là do t?ếp xúc vớ? g?a cầm sống trong kh? có ý kh?ến khác tuyên bố vẫn chưa có đủ bằng chứng chứng m?nh v?rus cúm H7N9 có thể lây từ g?a cầm sang ngườ?.Bộ Nông ngh?ệp Trung Quốc cho b?ết một cuộc đ?ều tra do H?ệp hộ? Nông ngh?ệp Động vật Trung Quốc thực h?ện xác nhận các trang trạ? g?a cầm đã hứng chịu tổn thất về mặt k?nh tế trực t?ếp là hơn 60 tỷ nhân dân tệ (trên 280 nghìn tỷ đồng) trong 6 tháng đầu năm 2013.Ngoà? ra, các trường hợp nh?ễm H7N9 mớ? được thông báo gần đây ở tỉnh Quảng Đông, G?ang Tô, Ch?ết G?ang và Thượng Hả? kh?ến con số th?ệt hạ? lên tớ? gần 20 tỷ nhân dân tệ. G?á g?a cầm sống và trứng cũng g?ảm mạnh. Trong tuần thứ tư của năm 201, g?á g?a cầm sống ở mức 17,31 tệ/1kg, g?ảm 4,42\% trong kh? g?á trứng g?ảm khoảng 10,21\% xuống mức 8,62 tệ/1kg.Một số công ty g?a cầm buộc phả? ngừng sản xuất và đố? mặt vớ? nguy cơ phá sản.Song Tú (Theo WantCh?naT?mes)Link nguồn: https://www.nguoiduatin.vn/dspl/trung-quoc-thiet-hai-tren-280-nghin-ty-vnd-vi-dich-h7n9-a21143.html "
Đùi gà Mỹ giá 20.000 đồng/kg: Ngành chăn nuôi Hoa Kỳ nói gì?,https://www.doisongphapluat.com/dui-ga-my-gia-20000-dongkg-nganh-chan-nuoi-hoa-ky-noi-gi-a104815.html,2015-08-05," (ĐSPL) - Chủ tịch Hiệp hội Xuất khẩu Trứng và Gia cầm Mỹ đã phủ nhận việc bán phá giá thịt gà Mỹ tại Việt Nam và khẳng định thịt gà nước này được bán đúng với quy định.. (ĐSPL) - Phản ứng trước thông tin cáo buộc bán phá giá thịt gà của Hiệp hội Chăn nuôi Đông Nam Bộ, Chủ tịch Hiệp hội Xuất khẩu Trứng và Gia cầm Mỹ (USAPEEC) đã phủ nhận việc bán phá giá thịt gà Mỹ tại Việt Nam và khẳng định thịt gà nước này được bán đúng với quy định của Tổ chức Thương mại Thế giới (WTO).[mecloud]snSRJtaDFN[/mecloud]Hiệp hội Chăn nuôi Đông Nam Bộ tuần qua cho biết đã có văn bản đề nghị Bộ Công Thương xem xét, điều tra việc có hay không tình trạng bán phá giá sản phẩm thịt gà Mỹ tại Việt Nam. Theo đơn vị này, có hiện tượng gà Mỹ nhập vào Việt Nam với giá 19.000 đồng một kg và bán ra thị trường TP HCM là 23.000 đồng, rẻ bằng nửa gà nội và gần bằng một phần tư giá bán cho người tiêu dùng tại Mỹ, khiến doanh nghiệp và người nông dân trong ngành lao đao.Trước vấn đề này, ông Tống Xuân Chinh - Phó Cục trưởng Cục Chăn nuôi (Bộ Nông nghiệp & Phát triển nông thôn) cho hay sau khi nhận được thông tin, Cục đã cử người đi khảo sát nhưng chưa phát hiện trường hợp đùi gà Mỹ bán với giá 20.000 đồng một kg (gần 1 USD). ""Khi chưa có bằng chứng thì chúng tôi chưa thể có ý kiến về vấn đề này”, ông Chinh nói.Tuy vậy, vị này cho rằng giá gà bình quân tại thị trường Mỹ trong quý II/2015 vẫn là 2-2,2 USD một kg (43.000 - 48.000 đồng), nên nếu thông tin của Hiệp hội là chính xác, sẽ là rất bất thường. Ông Chinh đặt ra trường hợp có thể trong thời gian Mỹ xảy ra dịch cúm gia cầm cuối năm 2014, một lượng lớn thịt gà phải dự trữ trong kho, nay mới tung ra bán với giá rẻ hơn bình thường. Chủ tịch Hiệp hội Xuất khẩu Trứng và Gia cầm Mỹ (USAPEEC) đã phủ nhận việc bán phá giá thịt gà Mỹ tại Việt Nam và khẳng định thịt gà nước này được bán đúng với quy định của Tổ chức Thương mại Thế giới (WTO).Ông khẳng định muốn xác định thịt gà Mỹ có bán phá giá hay không, cần phải có đầy đủ thông tin về giá thành sản xuất một kg thị gà ở Mỹ, Việt Nam là bao nhiêu, còn hiện tại chưa biết cụ thể Mỹ sản xuất thế nào thì khó có thể kết luận. ""Cần phải sang Mỹ xem xét các trang trại cũng như quy trình sản xuất của họ, sau đó so sánh với Việt Nam trên cùng một giống gà, cùng loại thức ăn, cùng một quy mô. Không thể so sánh người sản xuất 100.000 con với sản xuất 1.000 con"". ông Chinh chia sẻ.Phản ứng trước thông tin cáo buộc của Hiệp hội Chăn nuôi Đông Nam Bộ, Chủ tịch Hiệp hội Xuất khẩu Trứng và Gia cầm Mỹ (USAPEEC), Jim Sumner đã phủ nhận việc bán phá giá thịt gà Mỹ tại Việt Nam và khẳng định thịt gà nước này được bán đúng với quy định của Tổ chức Thương mại Thế giới (WTO).Theo ông Jim Sumner, một số phần thịt của gà Mỹ được bán tại Việt Nam ở mức giá tương tự hoặc cao hơn so với mức giá ở Mỹ, do đó theo quy định của Tổ chức Thương mại thế giới (WTO), các sản phẩm này không bị bán phá giá .Cũng theo lời ông Sumner, việc khiếu nại đang hướng về các sản phẩm thịt đùi gà đông lạnh nhưng các sản phẩm này không cạnh tranh trực tiếp với gà địa phương tươi nguyên con, vốn là sản phẩm ưa thích của người tiêu dùng Việt Nam.Ông Sumner cho biết USAPEEC và ngành công nghiệp gia cầm của Mỹ luôn ủng hộ ngành chăn nuôi gia cầm Việt Nam bằng việc tổ chức các hội thảo, tập huấn khác nhau nhằm mục đích hỗ trợ ngành chăn nuôi gia cầm Việt Nam về an toàn thực phẩm và an toàn sinh học.Theo thông cáo từ Tổng lãnh sự Mỹ, 2/3 lượng đùi gà góc tư của Mỹ được tiêu thụ tại thị trường nội địa, số còn lại được xuất khẩu tới hơn 125 quốc gia trên thế giới, trong đó có Việt Nam, ở mức giá thấp hơn so với giá của ức gà và cánh gà, nhưng với giá bán tương tự tại Mỹ. Các sản phẩm gia cầm của Mỹ được xuất khẩu sang Việt Nam chủ yếu là đùi gà góc tư, đùi gà, và chân gà. Tất cả đều được kiểm tra bởi Bộ Nông nghiệp Mỹ về độ tươi nguyên và những sản phẩm xuất khẩu phải đáp ứng được tiêu chuẩn cao về chất lượng và an toàn thực phẩm giống như những sản phẩm được tiêu thụ tại Mỹ.Chủ tịch USAPEEC cho biết thêm, năm 2010, Trung Quốc đã từng đưa ra vấn đề đánh thuế bán phá giá đối với ngành công nghiệp thịt gà Mỹ. Thế nhưng sau một quá trình pháp lý kéo dài, Tổ chức Thương mại Thế giới đã đưa ra phán quyết có lợi cho ngành công nghiệp sản xuất thịt gà Mỹ.Theo báo cáo Tổng điều tra Nông lâm thủy sản năm 2011 của Tổng cục Thống kê, trong tổng số hơn 7,8 triệu hộ sản xuất gia cầm, số hộ quy mô nhỏ (dưới 100 con) chiếm tới 90\%, nhưng quy mô siêu nhỏ (1-19 con) đã chiếm tới 55\%. So với tiêu chuẩn của Tổ chức Thú y Thế giới (OIE), quy mô chăn nuôi nhỏ lẻ của Việt Nam thấp hơn rất nhiều lần. OIE đánh giá hộ chăn nuôi nhỏ lẻ là 4.000 gà mái đẻ hoặc 5.000 gà thịt mỗi họ một năm.Tại cuộc họp báo chiều 31/7, Bộ trưởng - Chủ nhiệm Văn phòng Chính phủ Nguyễn Văn Nên cho biết câu chuyện giá thịt gà nhập khẩu từ Mỹ đã được Chính phủ thảo luận, Thủ tướng đã yêu cầu Bộ Nông nghiệp & Phát triển nông thôn cùng Bộ Công Thương điều tra kỹ lưỡng nhằm xem xét có dấu hiệu bán phá giá hay không.Ngọc Anh (Tổng hợp)Link nguồn: https://www.nguoiduatin.vn/dspl/dui-ga-my-gia-20000-dongkg-nganh-chan-nuoi-hoa-ky-noi-gi-a104815.html "
"Lây Nhiễm - Các bài viết Lây Nhiễm, Tin tức Lây Nhiễm - Trang 5",https://www.doisongphapluat.com/trang-5/lay-nhiem.html,,
"Dịch Cúm - Các bài viết Dịch Cúm, Tin tức Dịch Cúm",https://www.doisongphapluat.com/d%E1%BB%8Bch-c%C3%BAm.html,,
"Bài viết về "" Nguy Cơ Lây Nhiễm """,https://www.doisongphapluat.com/nguy-co-lay-nhiem.html,,"         Bộ Y tế khuyến cáo bệnh cúm gia cầm nguy cơ cao lây sang người     Thứ 2, 21/01/2019 | 04:55  Ông Phạm Hùng, Trưởng phòng kiểm soát bệnh truyền nhiễm cục Y tế Dự phòng (Bộ Y tế) khuyến cáo, không ăn tiết canh, không ăn gia cầm và các sản phẩm từ gia cầm ốm, chết,   "
Tù mù chất lượng Sản phẩm diệt khuẩn ăn theo dịch cúm,https://www.doisongphapluat.com/tu-mu-chat-luong-san-pham-diet-khuan-an-theo-dich-cum-a3029.html,2013-09-26," (ĐSPL) - Trên thị trường hiện đang tràn lan các sản phẩm chống dịch cúm gia cầm H1N1, H5N1,H7N1 ... Nó được quảng cáo có công năng đặc biệt nhằm khử vi khuẩn, siêu vi khuẩn trong phòng chống bệnh... Tuy nhiên, theo các chuyên gia, công dụng thật của sản phẩm không giống như những gì đã quảng cáo?! (ĐSPL) - Trên thị trường h?ện đang tràn lan các sản phẩm chống dịch cúm g?a cầm H1N1, H5N1, H7N1...  Nó được quảng cáo có công năng đặc b?ệt nhằm khử v? khuẩn, s?êu v? khuẩn trong phòng chống bệnh... Tuy nh?ên, theo các chuyên g?a, công dụng thật của sản phẩm không g?ống như những gì đã quảng cáo?!Sau dịch bệnh, khẩu trang hoạt tính t?ếp tục được nhà sản xuất b?ến tấu (có những sản phẩm được sử dụng cả thảo dược để phòng chống bệnh – PV). H?ện tạ? có những ch?ếc khẩu trang được b?ến tấu và được nhà sản xuất quảng cáo là có công năng chuyên chống các dịch bệnh như cúm g?a cầm, v?êm đường hô hấp, tăng khả năng m?ễn dịch dịch bệnh vớ? g?á bán từ 30.000-50.000 đồng/ch?ếc...Máy lọc không khí d?ệt khuẩn được bay bán ngoà? thị trường.Kế t?ếp, một số sản phẩm máy lọc không khí được quảng cáo có tác dụng d?ệt v? khuẩn, v?rus cúm A đã tạo sự thu hút, quan tâm của đông đảo ngườ? t?êu dùng. Đ?ển hình như sản phẩm máy lọc không khí K., xuất xứ từ Hàn Quốc, ngoà? tác dụng lọc không khí thông thường, loạ? máy này quảng cáo rất mạnh rằng có tính năng d?ệt đến 99,9\% một số type v?rus cúm A, g?úp phòng chống bệnh cúm và các bệnh đường hô hấp.Ngoà? ra, trên thị trường có các loạ? như: Quạt đ?ện, chổ? lau nhà, bàn chả? đánh răng; nồ? n?êu, thớt; tủ lạnh,  đ?ều hòa, máy sấy quần áo, máy sấy bát đĩa cũng có công năng d?ệt v?rus gây cúm...GS.TS Nguyễn Duy Thịnh, V?ện công nghệ S?nh học và công nghệ Thực phẩm - đạ? học Bách Khoa Hà Nộ? cho b?ết, vớ? loạ? thớt chống khuẩn, về nguyên tắc hoàn toàn có thể tạo ra được. Tuy nh?ên, chất M?croban trong thớt được g?ớ? th?ệu xâm nhập vào màng tế bào v? khuẩn để d?ệt khuẩn cũng có khả năng nh?ễm vào thực phẩm trong quá trình băm, thá? trên mặt thớt, từ đó gây hạ? cho sức khỏe. Hay như các sản phẩm được quảng cáo có công dụng d?ệt được 99\% các loạ? v? khuẩn, các type v?rus cúm A trong mô? trường thì chúng cũng sẽ d?ệt cả những v? khuẩn có lợ?, thậm chí “d?ệt cả con ngườ?”, tác động không tốt đến sức khỏe con ngườ?.Cũng theo GS Thịnh, các loạ? máy lọc không khí, vớ? nguyên lý hoạt động là sử dụng màng lọc có thể g?ữ lạ? một số v? khuẩn bám trên bụ?, nhưng hầu hết đó chỉ là bụ? thô chứ không phả? bụ? t?nh, nó? chúng có thể t?êu d?ệt được đến 99\% các loạ? v? khuẩn, v?rus cúm ... là chuyện hết sức v?ển vông. Tương tự, bác sỹ Nguyễn Hồng Hà, Phó G?ám đốc bệnh v?ện Nh?ệt đớ? Trung ương khẳng định, từ trước tớ? nay chưa có bất cứ ngh?ên cứu nào chứng m?nh thảo dược có khả năng d?ệt được v?rus, đặc b?ệt là các loạ? v?rus cúm.GS.TS Nguyễn Trần H?ển, V?ện trưởng v?ện Vệ s?nh dịch tễ trung ương cho b?ết thêm, để phòng bệnh cúm, ngành y tế khuyến cáo b?ện pháp quan trọng nhất là ngườ? dân phả? tăng cường đảm bảo vệ s?nh cá nhân, vệ s?nh nơ? ở, thường xuyên rửa tay bằng xà phòng.Quỳnh Ch? – Phạm Th?ệu Link nguồn: https://www.nguoiduatin.vn/dspl/tu-mu-chat-luong-san-pham-diet-khuan-an-theo-dich-cum-a3029.html "
"Quảng Ngãi: Tiêu hủy 12.000 con chim cút nhiễm cúm A/H5N1, A ...",https://www.doisongphapluat.com/quang-ngai-tieu-huy-12000-con-chim-cut-nhiem-cum-ah5n1-ah5n6-a75219.html,2014-12-20," (ĐSPL) - Ngày 18/12, Chi cục Thú y tỉnh Quảng Ngãi đã tiến hành tiêu hủy toàn bộ 12.000 con chim cút nhiễm cúm A/H5N1, A/H5N6 gia đình ông Điệp.  (ĐSPL) - 12.000 con chim cút ở Quảng Ngãi bị phát hiện nhiễm vi rút cúm A/H5N1, A/H5N6 đã được cơ quan chức năng tiến hành tiêu hủy.Theo tin tức từ báo Người lao động, ngày 18/12, Chi cục Thú y tỉnh Quảng Ngãi đã tiến hành tiêu hủy toàn bộ 12.000 con chim cút của gia đình ông Phạm Hoàng Điệp, ở đội 8, thôn Lâm Lộc Bắc, xã Tịnh Hà, huyện Sơn Tịnh (Quảng Ngãi) sau khi phát hiện đàn chim cút nhiễm vi rút cúm A/H5N1, A/H5N6.Lực lượng chức năng đang tiến hành tiêu hủy. (Ảnh: NLĐ).Toàn bộ số chim cút trên được gia đình ông Điệp nuôi đến nay là 7 tháng tuổi. Theo lời ông Điệp, ngày 15/12, ông phát hiện có nhiều con chim cút chết bất thường và báo với chính quyền địa phương. Sau khi gửi mẫu xét nghiệm, Cơ quan Thú y vùng 4 kiểm nghiệm cho kết quả dương tính với vi rút cúm A/H5N1, A/H5N6.Ngay sau khi tiến hành tiêu hủy đàn chim cút, Cơ quan Thú y vùng 4 đã thực hiện các biện pháp tiêu độc, khử trùng và xử lý xác gia cầm bị chết tại trại chăn nuôi của hộ ông Phạm Hoàng Điệp. Đồng thời triển khai các biện pháp để phòng chống dịch cúm A/H5N1, A/H5N6 lây sang người.Trao đổi với PV báo Đại đoàn kết, ông Đặng Thanh Hậu – Phó phòng NN&PTNT huyện Sơn Tịnh cho biết: Hiện nay, do tình hình thời tiết diễn biến phức tạp cho nên dịch bệnh đối với gia súc, gia cầm rất dễ xảy ra, khi nhận được thông tin vùng 4 có đàn chim cút của gia đình ông Điệp bị dương tính với A/H5N6, Ban chỉ đạo của huyện đã phối hợp cùng các cơ quan chức năng tiến hành xử lý theo quy định, tổ chức dập ổ dịch.Nhằm ngăn chặn không cho dịch bệnh lây lan trên diện rộng, Ban chỉ đạo phòng chống dịch bệnh gia súc, gia cầm huyện Sơn Tịnh đã chỉ đạo khẩn trương phun thuốc, rải vôi khử trùng chuồng trại cho hộ gia đình có dịch xảy ra, các hộ chăn nuôi xung quanh khu vực xảy ra ổ dịch và trên toàn địa bàn huyện. Ông Đặng Thanh Hậu cho biết thêm: Phòng chống dịch là việc làm thường xuyên trên địa bàn, tại điểm dịch chúng tôi đã khuyến cáo chính quyền địa phương và nhân dân chú trọng công tác phòng dịch, trước mắt tổ chức tiêm phòng bao vây và tổ chức ra quân phun thuốc để khử trùng, tiêu độc nhằm tiêu diệt ngay mầm bệnh, cụ thể là tại điểm dịch và các hộ xung quanh.Link nguồn: https://www.nguoiduatin.vn/dspl/quang-ngai-tieu-huy-12000-con-chim-cut-nhiem-cum-ah5n1-ah5n6-a75219.html "
