Title,URL,Date,Content
"Bệnh nhân nhập viện do mắc cúm gia tăng, Bộ Y tế họp khẩn",https://www.doisongphapluat.com/tin-tuc/benh-nhan-nhap-vien-do-mac-cum-gia-tang-bo-y-te-hop-khan-a219780.html,2018-02-13," Trước những diễn biến phức tạp của dịch cúm, chiều 13/2, Bộ Y tế họp khẩn đối phó với dịch trước lượng bệnh nhân nhập viện vì bệnh này tăng. Trước những diễn biến phức tạp của dịch cúm, chiều 13/2, Bộ Y tế họp khẩn đối phó với dịch trước lượng bệnh nhân nhập viện vì bệnh này tăng.Trước những diễn biến phức tạp của dịch bệnh trong thời gian qua, chiều ngày 13/2, Bộ Y tế đã tiến hành họp khẩn cấp với các đơn vị liên quan, nhằm tăng cường đối phó với dịch bệnh, nhất là trong đợt nghỉ Tết Nguyên đán kéo dài.Tại Bệnh viện Nhi Trung ương, chỉ tính từ đầu năm 2018 đến nay, đã có hơn 700 ca mắc cúm được phát hiện tại viện. Hiện tại vẫn còn tới 63 ca đang điều trị nội trú tại khoa Truyền nhiễm.Đa số các trường hợp đều mắc cúm mùa thông thường (chủng cúm A/H1N1), chỉ có số rất ít là mắc cúm B. Trong số các bệnh nhi mắc cúm đã có trường hợp nặng với dấu hiệu viêm đường hô hấp, viêm phổi, sốt cao không đáp ứng với thuốc hạ sốt, hoặc dẫn đến co giật…Đại diện BV Saint Paul cho hay từ đầu mùa đến nay có khoảng 400 bệnh nhân cúm điều trị, hiện đang điều trị nội trú cho 70 ca, không có tử vong. Bệnh viện có đủ thuốc dành cho bệnh nhân nặng. Còn tại BV Đống Đa, từ đầu năm 2018 mỗi ngày BV đón khoảng 10 bệnh nhân cúm đến khám mỗi ngày. Hiện BV đã triển khai test chẩn đoán sáng lọc cúm, dành 15 giường để điều trị bệnh nhân cúm. Ảnh minh hoạ.Trước tình hình này, PGS.TS Lương Ngọc Khuê đã yêu các bệnh viện chủ động triển khai các biện pháp phòng, chống dịch bệnh, không để bùng phát dịch bệnh trong mùa đông xuân, mùa Lễ hội và Tết Nguyên đán Mậu Tuất 2018. Chú trọng công tác truyền thông như tuyên truyền mạnh mẽ lợi ích của việc tiêm vắc xin phòng bệnh; hướng dẫn người dân thực hiện tốt vệ sinh môi trường, vệ sinh cá nhân; thực hiện ăn chín, uống chín; thực hiện an toàn thực phẩm trong giết mổ gia súc, gia cầm và chế biến các sản phẩm từ gia súc, gia cầm;PGS.TS Nguyễn Duy Cường – Trưởng khoa Truyền nhiễm (BV Bạch Mai) cho biết, hiện khoa chỉ tiếp nhận những trường hợp mắc cúm A nặng, có biến chứng còn với những trường hợp nhẹ sẽ hướng dẫn điều trị tại nhà.Điều PGS Cường lưu ý là các bà bầu hoặc người bệnh có bệnh lý nền mắc cúm sẽ ảnh hưởng đến sức khỏe rất lớn Vì thế đối tượng này cần phải được theo dõi sát sao. “Riêng ngày 12/2, có tới 4 bà bầu nhập viện vì cúm, các bà bầu hiện đang được theo dõi và may mắn là không có biểu hiện gì nặng.Tuy nhiên, gia đình hết sức lo lắng vì bà bầu bị cúm sợ ảnh hưởng đến thai nhi, vì thế chúng tôi phải giải thích cụ thể để người nhà an tâm. Theo đó, cả 4 bà bầu đều đang ở giai đoạn thứ 2 của thai kỳ (qua 3 tháng đầu). Đây là giai đoạn ít bị ảnh hưởng hơn, nhưng cũng không thể chủ quan và cần phải theo dõi chặt chẽ. Hiện chúng tôi vẫn đang cho sử dụng thuốc Tamiflu và tiếp tục theo dõi”, BS Cường chia sẻ.Ths Nguyễn Trọng Khoa, Phó Cục trưởng Cục Quản lý Khám chữa bệnh, Bộ Y tế khuyến cáo các bác sĩ không nên chỉ định sử dụng rộng rãi Tamiflu, để tránh kháng thuốc và tránh tạo nên cơn sốt giả về loại thuốc này; yêu cầu các bệnh viện giám sát chặt chẽ các bác sĩ trong việc kê đơn Tamiflu.Mỹ An (T/h)Link nguồn: https://www.nguoiduatin.vn/dspl/benh-nhan-nhap-vien-do-mac-cum-gia-tang-bo-y-te-hop-khan-a219780.html "
Tin tức đời sống mới nhất ngày 1/7/2019: Người phụ nữ muốn lấy ...,https://www.doisongphapluat.com/tin-tuc-doi-song-moi-nhat-ngay-172019-nguoi-phu-nu-muon-lay-them-chong-thu-24-a282189.html,2019-06-30," Tin tức đời sống mới nhất ngày 1/7/2019. Cập nhật tin đời sống mới ngày 1/7/2019 trên trang Đời sống & Pháp luật. Tin tức đời sống mới nhất ngày 1/7/2019. Cập nhật tin đời sống mới ngày 1/7/2019 trên trang Đời sống & Pháp luật.Người phụ nữ muốn lấy thêm chồng thứ 24 Bà Wolfe và ""bộ ảnh sưu tập"" chồng của mình. Bà Linda Wolfe, một phụ nữ 68 tuổi ở Indiana đã kết hôn 23 lần và mong muốn có người chồng thứ 24.Cuộc sống của bà Wolfe rất thú vị. Cuộc hôn nhân đầu tiên của bà vào năm 1957 là vì tình yêu (chồng bà lúc đó 31 tuổi; bà mới 16 tuổi).Năm 1996, bà tiếp tục kết hôn vì công khai và nhiều lần, trở người phụ nữ ""kết hôn nhất"" được kỷ lục thế giới Guinness ghi nhận. Trong quãng thời gian đó bà Wolfe kết hôn với một tù nhân bị chột một mắt. Hai người chồng của bà là người đồng tính, hai người vô gia cư. Một số người chồng lừa dối bà…Cho đến khi cuộc hôn nhân thứ 23 kết thúc vì chồng bà qua đời, bà Wolfe đã sống độc thân cả chục năm - thời gian độc thân dài nhất của bà từ trước đến nay.""Nhưng tôi sẽ kết hôn lần nữa"", bà Wolfe nói, ""bởi vì, bạn biết đấy, thật cô đơn làm sao"".Cảnh báo sốt xuất huyết gia tăng, nhiều ca nặng từ đầu mùa Nhiều người chủ quan dẫn đến sốt xuất huyết nặng. Ảnh: Thanh NiênNgày 30/6, theo thông tin từ Bệnh viện Bệnh nhiệt đới (TP.HCM), số ca sốt xuất huyết nhập viện tại đây đã tăng gần gấp đôi so với cùng kỳ năm ngoái.Hiện bệnh viện phải kê thêm giường cho bệnh nhân sốt xuất huyết. Riêng tại Khoa Nhiễm D (điều trị sốt xuất huyết cho người lớn), đã được tăng thêm 30 giường mà vẫn có bệnh nhân phải nằm hành lang.Theo bác sĩ chuyên khoa 2 Nguyễn Thanh Phong, Trưởng Khoa Nhiễm D, Bệnh viện Bệnh Nhiệt đới, đỉnh dịch sốt xuất huyết thông thường rơi vào tháng 8, 9, 10. Thế nhưng hiện nay, mới vào đầu mùa dịch, số lượng bệnh đã tăng cao, với nhiều ca nặng là điều đáng lo ngại, cần cảnh báo.Thái Bình: Xuất hiện dịch cúm gia cầm A/H5N6Thái Bình: Xuất hiện dịch cúm gia cầm A/H5N6. Ảnh: báo Pháp Luật TP.HCMTheo báo Pháp Luật TP.HCM, ngày 30/6, thông tin từ Chi cục Chăn nuôi và Thú y tỉnh Thái Bình cho biết trên địa bàn huyện Thái Thụy vừa xuất hiện một ổ dịch cúm A/H5N6. Theo đó, vào ngày 24/6, đàn vịt hơn 1.000 con nhà ông Nguyễn Đức Thuần (xã Thụy Hồng) bị chết hàng loạt không rõ nguyên nhân. Số lượng vịt chết lên đến khoảng 300 con.Nhận được thông tin, cán bộ thú y địa phương đã khẩn trương lấy mẫu bệnh phẩm gửi đi xét nghiệm. Kết quả, mẫu bệnh phẩm dương tính với virus cúm A/H5N6.Sau khi có kết quả, Chi cục Chăn nuôi và Thú y Thái Bình đã phối hợp với gia đình, chính quyền địa phương tiến hành tiêu hủy 700 con vịt còn lại. Mộc Miên (T/h)Link nguồn: https://www.nguoiduatin.vn/dspl/tin-tuc-doi-song-moi-nhat-ngay-172019-nguoi-phu-nu-muon-lay-them-chong-thu-24-a282189.html "
"""Viết về Đại tướng Võ Nguyên Giáp"" của tác giả Nguyễn Thúy Quỳnh",https://www.doisongphapluat.com/viet-ve-dai-tuong-vo-nguyen-giap-a9021.html,2013-11-14," Tác phẩm tham dự Cuộc thi viết về Đại tướng Võ Nguyên Giáp MS350: ""Viết về Đại tướng Võ Nguyên Giáp"" của tác giả Nguyễn Thúy Quỳnh (thành phố Irkutsk, Liên bang Nga). Tác phẩm tham dự Cuộc th? v?ết về Đạ? tướng Võ Nguyên G?áp MS350: ""V?ết về Đạ? tướng Võ Nguyên G?áp"" của tác g?ả Nguyễn Thúy Quỳnh (thành phố Irkutsk, L?ên bang Nga).V?ết về Đạ? tướng Võ Nguyên G?ápCho cháu gọ? Đạ? tướng bằng một cách xưng hô g?ản dị: ông G?áp. Có lẽ kh? ngườ? ta đánh mất đ? cá? gì rồ? mớ? cảm thấy t?ếc, mớ? thấy g?á trị của nó. Trong tâm trí của một cô gá? thuộc thế hệ 9x như cháu, ông như một ngườ? cha g?à thứ ha? của dân tộc, tuy không s?nh ra và lớn lên trong khó? lửa của ch?ến tranh, nhưng qua sách vở, qua lờ? kể của những ngườ? đ? trước, đủ để cháu h?ểu ông là một hình tượng lớn lao lắm, vĩ đạ? lắm. S?nh, lão, bệnh, tử, b?ết là những đ?ều chẳng bao g?ờ có thể thay đổ? được, nhưng ông đ?, cả dân tộc t?ếc nuố?.Cứ thỉnh thoảng trong tâm trí cháu lạ? nhó? lên cá? xót xa của một đứa con xa quê. Đau đớn làm sao kh? một con ngườ? vĩ đạ? của dân tộc qua đờ? , trả? qua hơn 1 thế kỷ, chứng k?ến b?ết bao nh?êu thăng trầm của thế g?ớ? nó? chung và V?ệt Nam nó? r?êng: ch?ến tranh thế g?ớ? thứ nhất, ch?ến tranh thế g?ớ? thứ ha? và những bước ngoặt lịch sử của V?ệt Nam ta.Thế hệ bọn cháu s?nh ra và lớn lên trong một mô? trường chẳng thể chê vào đâu: được ăn ngon mặc đẹp, được đ? học vớ? bạn bè thầy cô, sống trong một đất nước yên bình. Chắc chẳng bao g?ờ bọn cháu có thể tưởng tượng nổ? sự tàn khốc của ch?ến tranh, sự đau thương vẫn còn tồn tạ? ám ảnh cho tớ? tận bây g?ờ. Cháu cũng như nh?ều bạn học cùng trang lứa, vì thế mà b?ết đến lịch sử V?ệt Nam như một môn học bắt buộc, b?ết đến ông qua những trang sách mà thô?.Bức ảnh được chụp năm 2004 của ông ngoạ? tác g?ả và Đạ? tướng Võ Nguyên G?áp.Nhưng cháu có một may mắn lớn là s?nh ra trong một g?a đình cách mạng, ông bà cháu đều đã từng là những ngườ? lính cầm súng vì Tổ Quốc. Hôm rồ?, nghe t?n ông mất, cháu cũng hẫng hụt hệt như ngày ông cháu mất vậy. Ngồ? xem lạ? những thước ph?m tư l?ệu, cháu chợt thấy hình ảnh ông cháu cùng xuất h?ện bên cạnh ông, tự nh?ên nước mắt cháu chảy dà?. Vậy là thế hệ ấy, những con ngườ? ấy đã ở một thế g?ớ? khác, b?ết bao nh?êu lâu nữa đất nước mình mớ? xuất h?ện thêm những vĩ nhân như Bác Hồ, như ông.Cháu đ? học xa nhà, nghe t?n dữ của cả dân tộc mà đ?ều k?ện chẳng cho phép để được hòa vào dòng ngườ? đến v?ếng ông, nên cháu chỉ b?ết v?ết thành những dòng tâm thư này co? như lờ? chào t?ễn b?ệt ông về nơ? xa ấy.Tác g?ả: Nguyễn Thúy Quỳnh (thành phố Irkutsk, L?ên bang Nga)Link nguồn: https://www.nguoiduatin.vn/dspl/viet-ve-dai-tuong-vo-nguyen-giap-a9021.html "
"Giao lưu trực tuyến ""Cộng đồng chung tay phòng chống dịch""",https://www.doisongphapluat.com/9h-sang-thu-2-giao-luu-truc-tuyen-cong-dong-chung-tay-phong-chong-dich-benh-a143472.html,2016-08-12," (ĐSPL) - 9h sáng thứ 2 (15/8), Báo Đời sống & Pháp luật cùng Người đưa tin sẽ phối hợp tổ chức chương trình GLTT với chủ đề ""Cộng đồng chung tay phòng chống dịch bệnh"". (ĐSPL) - 9h sáng thứ 2 (15/8), Báo Đời sống & Pháp luật cùng báo Người đưa tin sẽ phối hợp tổ chức chương trình giao lưu trực tuyến với chủ đề ""Cộng đồng chung tay phòng chống dịch bệnh"".Bắt đầu từ 9h sáng 15/8, Báo Đời sống & Pháp luật, Người đưa tin tổ chức chương trình giao lưu trực tuyến với chủ đề: “Cộng đồng chung tay phòng chống dịch bệnh”.Chương trình có sự tham gia của các khách mời: - Phó Giáo sư, tiến sỹ Hoàng văn Tân - Phó trưởng ban thường trực chương trình khống chế và loại trừ bệnh dại, bộ y tế- Phó trưởng phòng dịch tễ ông Phạm Quang Minh - Cục thú y- Bà Nguyễn Thị Hường - Phòng kiểm soát bệnh truyền nhiễm - Cục y tế dự phòng.Đến với chương trình, quý độc giả sẽ được lắng nghe những chia sẻ hữu ích nhất của các chuyên gia y tế về công cuộc phòng chống dịch bệnh, các giải pháp phòng chống bệnh dại, bệnh cúm gia cầm… để mang lại môi trường sống lành mạnh, an toàn cho cộng đồng.Chương trình được kéo dài đến 11h cùng ngày và sẽ được cập nhật trực tiếp trên trang doisongphapluat.com, live stream trên fanpage của báo Đời sống & Pháp luật (https://www.facebook.com/doisongphapluatonline).Tại buổi giao lưu các chuyên gia y tế luôn sẵn lòng trả lời mọi thắc mắc của quý độc giả. Vì vậy, quý độc giả có thể gửi câu hỏi về địa chỉ e-mail: [email protected], đặt câu hỏi trên fanpage của báo hoặc liên hệ qua đường dây nóng: 0904.065.256 để được tư vấn, hỗ trợ.PVLink nguồn: https://www.nguoiduatin.vn/dspl/9h-sang-thu-2-giao-luu-truc-tuyen-cong-dong-chung-tay-phong-chong-dich-benh-a143472.html "
Nghi phạm tạt axit mù mắt nữ phụ bếp ở Hòa Bình khai gì?,https://www.doisongphapluat.com/nghi-pham-tat-axit-mu-mat-nu-phu-bep-o-hoa-binh-khai-gi-a291110.html,2019-08-31," Theo thông tin từ cơ quan chức năng, bước đầu, đối tượng Cảnh khai nhận không quen biết nạn nhân, và được thuê thực hiện hành vi tạt a xít. Theo thông tin từ cơ quan chức năng, bước đầu, đối tượng Cảnh khai nhận không quen biết nạn nhân, và được thuê thực hiện hành vi tạt a xít. Nghi phạm Nguyễn Văn Cảnh. Ảnh: Ngô Thủy. Tri thức trực tuyến.Liên quan đến vụ nữ nhân viên ở Hòa Bình bị tạt a xít, báo An Ninh Thủ Đô cho hay, khoảng 16h chiều nay (31/8), Nguyễn Văn Cảnh (SN 1988, trú xã Long Hà, huyện Phú Riềng, Bình Phước), nghi can gây ra vụ tạt axit trúng mặt nữ nhân viên trạm dừng nghỉ trên địa bàn huyện Cao Phong tỉnh Hòa Bình đã được dẫn giải từ Bình Phước ra sân bay Nội Bài rồi đưa về Hòa Bình.Thượng tá Bùi Thế Thành thông tin, sau thời gian bị truy lùng gắt gao, biết không thể lẩn tránh, đối tượng Cảnh đã xin đầu thú, và bước đầu khai nhận hành vi phạm tội manh động. “Vụ án còn nhiều vấn đề phải tập trung đấu tranh để làm rõ nguyên nhân, động cơ gây án của đối tượng. Bước đầu, đối tượng Cảnh khai nhận không quen biết nạn nhân, và được thuê thực hiện hành vi tạt a xít”, Thượng tá Bùi Thế Thành cho biết.   Your browser does not support the video tag. Trước đó, theo Tri thức trực tuyến, ngày 18/8 Cảnh dùng cốc sứ tạt axit vào mặt bà Bùi Thị Nhâm trong lúc nạn nhân đang làm việc tại khu bếp của trạm dừng nghỉ Như Ngọc 358, Quốc lộ 6 (thuộc địa phận xã Tây Phong, huyện Cao Phong, tỉnh Hòa Bình), khiến nạn nhân bị bỏng cả mặt và hỏng một bên mắt.Sau khi xảy ra vụ án, Ban Giám đốc Công an tỉnh Hòa Bình chỉ đạo thành lập ban chuyên án, xác định nhân thân nghi phạm và cử tổ công tác vào các tỉnh phía Nam để truy bắt Cảnh theo lệnh bắt khẩn cấp.Mỹ An (T/h)Link nguồn: https://www.nguoiduatin.vn/dspl/nghi-pham-tat-axit-mu-mat-nu-phu-bep-o-hoa-binh-khai-gi-a291110.html "
"Dịch Bệnh - Các bài viết Dịch Bệnh, Tin tức Dịch Bệnh - Trang 35",https://www.doisongphapluat.com/trang-35/dich-benh.html,,
"Thị Trường - Các bài viết Thị Trường, Tin tức Thị Trường - Trang 18",https://www.doisongphapluat.com/trang-18/thi-truong.html,,
"Trung Quốc đã ""vượt mặt"" Mỹ trong lĩnh vực vũ khí thông minh nhân ...",https://www.doisongphapluat.com/trung-quoc-da-vuot-mat-my-trong-linh-vuc-vu-khi-thong-minh-nhan-tao-a211028.html,2017-11-28," Mới đây, đại diện Trung Quốc đã chiến thắng trong một cuộc thi ứng dụng trí thông minh nhân tạo (AI) vào phòng bị và cứu hộ quân sự tổ chức tại Mỹ Mới đây, đại diện Trung Quốc đã chiến thắng trong một cuộc thi ứng dụng trí thông minh nhân tạo (AI) vào phòng bị và cứu hộ quân sự tổ chức tại Mỹ.Yitu Tech, một công ty mới thành lập đến từ Trung đã xuất sắc vượt qua nhiều đại diện các quốc gia hàng đầu về công nghệ như Mỹ, Nhật Bản... để giành giải thưởng cao nhất trị giá 25.000 USD trong cuộc thi về các thiết bị thông minh nhân tạo trong quân sự và quốc phòng.Giải thưởng này đã khiến nhiều chuyên gia vũ khí Mỹ cảnh giác về tốc độ phát triển thần tốc cũng như tiềm lực của quân đội Trung Quốc trong lĩnh vực vũ khí AI nói riêng và hiện đại hóa ngành khoa học vũ khí nói chung. Công ty Yitu Tech là đối tác lớn của Microsoft - Ảnh: YituTechTheo báo cáo của Trung tâm Khoa học An ninh Mỹ (CNAS), Trung Quốc đã vượt qua thời kỳ học theo các phát minh của Mỹ và thậm chí còn làm tốt hơn trên một số lĩnh vực như dập dịch cúm gia cầm diện rộng, phòng chống thiên tai…Chủ tịch điều hành Alphabet Inc, Eric Schmidt, người đứng đầu Ban cố vấn Lầu Năm Góc, từng đưa ra một cảnh báo tương tự về tiềm năng của Trung Quốc tại một cuộc họp ở Washington rằng vũ khí AI đã trở thành kế hoạch quốc gia của thủ đô Bắc Kinh.Theo Reuters, một tài liệu chưa công bố của Lầu Năm Góc từ đầu năm 2017 đã cảnh báo việc nhiều công ty Trung Quốc đang tìm cách tiếp cận với quá trình nghiên cứu và phát triển AI của Mỹ thông qua việc thâu tóm cổ phần các công ty công nghệ. Hiện nay, một nhóm các nhà lập pháp ở Thượng viện và Hạ viện đề xuất một số dự luật thắt chặt đầu tư nước ngoài vào Mỹ.Trí tuệ nhân tạo hứa hẹn một cuộc cách mạng to lớn trên mọi lĩnh vực của đời sống như vận chuyển, y tế, công nghiệp và quân sự. Tại Mỹ, các loại máy bay tiêm kích không người lái đang được cải tiến với độ chính xác ngày càng cao trong khi Quân đội Trung Quốc cũng đang đầu tư vào một loạt các dự án liên quan đến AI.Trước đây, Lầu Năm Góc từng gửi một bản khuyến cáo về các vấn đề đạo đức xã hội khi lạm dụng vũ khí AI trong chiến tranh tới chính quyền Bắc Kinh nhưng chưa nhận được hồi âm.Thu Phương (Theo Reuters) Link nguồn: https://www.nguoiduatin.vn/dspl/trung-quoc-da-vuot-mat-my-trong-linh-vuc-vu-khi-thong-minh-nhan-tao-a211028.html "
"Triều Tiên tạo ra thuốc chữa MERS, Ebola, AIDS và SARS",https://www.doisongphapluat.com/trieu-tien-tuyen-bo-che-duoc-thuoc-dieu-tri-mers-ebola-aids-va-sars-a99112.html,2015-06-20," (ĐSPL) - Hãng KCNA vừa tuyên bố một tin tức gây chấn động- Triều Tiên chế tạo thành công một loại thuốc điều trị các dịch bệnh MERS, Ebola, SARS và AIDS. (ĐSPL) - Hãng KCNA vừa tuyên bố một tin tức gây chấn động- Triều Tiên chế tạo thành công một loại thuốc điều trị các dịch bệnh MERS, Ebola, SARS và AIDS.AFP dẫn thông báo của hãng thông tấn trung ương Triều Tiên (KCNA) cho biết, loại thuốc mới được gọi là Kumdang-2, có khả năng chữa trị nhiều bệnh nan y, bao gồm cả căn bệnh thế kỷ AIDS. Ngoài ra, thuốc còn chữa được ung thư, lao, MERS, Ebola và cả tác hại từ việc sử dụng máy tính hay ốm nghén. Loại thuốc chữa các dịch bệnh nguy hiểm được đăng tải lên trang Kimdang2.com.Kumdang- 2 được chiết xuất từ nhân sâm quý hiếm và các loại thảo dược khác. Những cây nhân sâm này được các nhà khoa học Triều Tiên chăm sóc bằng một loại phân bón đặc biệt kết hợp giữa đất hiếm.Theo KCNA, virus gây ra các căn bệnh MERS, Ebola, SARS và AIDS đều làm suy yếu hệ miễn dịch của người bệnh. Trong khi đó, Kumdang-2 có khả năng tái tạo hệ thống miễn dịch để chống chọi lại các căn bệnh vừa nêu.Dù công bố thông tin gây chấn động giới khoa học nhưng hãng thông tấn nhà nước Triều Tiên không đưa ra bằng chứng cụ thể để chứng minh.Trang web thân Triều Tiên Minjok Tongshin tiết lộ loại thuốc này được sản xuất lần đầu tiên vào năm 1996.Tuy nhiên, các nhà khoa học quốc tế tỏ ra không tin tưởng thông báo từ KCNA. Hồi năm 2006 và 2013, Bình Nhưỡng cũng loan tin họ sản xuất được loại thuốc tương tự Kumdang-2 có thể chữa được bệnh cúm gia cầm.Hiện tại, trang Kumdang2.com đang chia sẻ thông tin về loại thuốc trị MERS, Ebola, SARS và AIDS bằng tiếng Nga và tiếng Anh. Nhà phân phối Korea Bud trụ sở ở Moscow (Nga) sẽ cung cấp thuốc cho công dân châu Âu.NGUYỄN NGỌC (Theo Telegraph)Link nguồn: https://www.nguoiduatin.vn/dspl/trieu-tien-tuyen-bo-che-duoc-thuoc-dieu-tri-mers-ebola-aids-va-sars-a99112.html "
"Truyen hinh - Tin Đài truyền hình Hà Nội Việt Nam, Kênh truyền hình ...",https://www.doisongphapluat.com/giai-tri/truyen-hinh/page/369,,
